{
  "$schema": "https://json-schema.org/draft/2020-12/schema",
  "$id": "https://contracts.fullchaos.dev/acr/v1/credential_rotate_response.v1.schema.json",
  "title": "Self Credential Rotation Response v1",
  "type": "object",
  "additionalProperties": false,
  "required": ["schema_version", "access_token", "credential", "receipt"],
  "properties": {
    "schema_version": { "const": "credential_rotate_response.v1" },
    "access_token": { "type": "string", "minLength": 1, "maxLength": 512 },
    "credential": { "$ref": "acr_client_credential.v1.schema.json" },
    "receipt": {
      "type": "object",
      "additionalProperties": false,
      "required": ["source_credential_id", "replacement_credential_id", "rollback_until"],
      "properties": {
        "source_credential_id": { "type": "string", "minLength": 8, "maxLength": 256 },
        "replacement_credential_id": { "type": "string", "minLength": 8, "maxLength": 256 },
        "rollback_until": { "type": "string", "format": "date-time" }
      }
    }
  }
}
