{
  "schema_version": "credential_rotate_response.v1",
  "access_token": "[REDACTED]",
  "credential": {
    "schema_version": "acr_client_credential.v1",
    "credential_id": "cred_01J0ACR002",
    "name": "Chris local sidecar",
    "token_prefix": "fcacr_efgh5678",
    "org_id": "org_fullchaos",
    "repository_scopes": ["full-chaos/dev-health-acr"],
    "scopes": ["context:read", "evidence:read"],
    "created_at": "2026-07-10T14:00:00Z",
    "expires_at": "2026-10-08T14:00:00Z",
    "revoked_at": null,
    "last_used_at": null
  },
  "receipt": {
    "source_credential_id": "cred_01J0ACR001",
    "replacement_credential_id": "cred_01J0ACR002",
    "rollback_until": "2026-07-10T14:15:00Z"
  }
}
